{
  "project_id": "SAV_DEP_2026_01",
  "plan_version": "1.0.0",
  "created_at": "2026-10-17T09:00:00Z",
  "stages": [
    {
      "stage_id": 1,
      "name": "Plan Approval",
      "owner_agent": "hermes-orchestrator",
      "inputs": [
        "execution_request.json"
      ],
      "outputs": [
        "execution_plan.json"
      ],
      "approval_required": true,
      "status": "COMPLETED"
    },
    {
      "stage_id": 3,
      "name": "Market research",
      "owner_agent": "multi-source-researcher",
      "inputs": [
        "research_task.json"
      ],
      "outputs": [
        "research_output.json"
      ],
      "approval_required": false,
      "status": "COMPLETED"
    },
    {
      "stage_id": 4,
      "name": "Product strategy",
      "owner_agent": "product-manager",
      "inputs": [
        "product_brief.json",
        "research_output.json"
      ],
      "outputs": [
        "product_strategy.json"
      ],
      "approval_required": false,
      "status": "COMPLETED"
    },
    {
      "stage_id": 5,
      "name": "Legal Check-in 1",
      "owner_agent": "legal-compliance-counsel",
      "inputs": [
        "legal_review_request.json"
      ],
      "outputs": [
        "legal_compliance_report.json"
      ],
      "approval_required": false,
      "status": "COMPLETED"
    }
  ],
  "approval": {
    "status": "APPROVED",
    "approved_by_human": true,
    "approved_at": "2026-10-17T10:00:00Z",
    "comments": "План утвержден на Stage-Gate 1"
  }
}
